{
  "device_id": 42,
  "period_start": "2026-09-06T09:05:00Z",
  "period_end": "2026-09-06T09:10:00Z",
  "applications": [
    {
      "name": "VS Code",
      "process_name": "Code.exe",
      "category": "development",
      "start_time": "2026-09-06T09:05:00Z",
      "end_time": "2026-09-06T09:06:30Z",
      "duration_seconds": 90,
      "resource_usage": {
        "avg_cpu_percent": 10.0,
        "max_cpu_percent": 25.0,
        "avg_gpu_percent": 1.0,
        "max_gpu_percent": 3.0,
        "sample_count": 9
      }
    },
    {
      "name": "Chrome",
      "process_name": "chrome.exe",
      "category": "browser",
      "start_time": "2026-09-06T09:06:30Z",
      "end_time": "2026-09-06T09:10:00Z",
      "duration_seconds": 210,
      "resource_usage": {
        "avg_cpu_percent": 9.5,
        "max_cpu_percent": 22.0,
        "avg_gpu_percent": 4.0,
        "max_gpu_percent": 12.0,
        "sample_count": 21
      },
      "browser_tabs": [
        {
          "domain": "github.com",
          "start_time": "2026-09-06T09:06:30Z",
          "end_time": "2026-09-06T09:08:45Z",
          "duration_seconds": 135
        },
        {
          "domain": "stackoverflow.com",
          "start_time": "2026-09-06T09:08:45Z",
          "end_time": "2026-09-06T09:09:30Z",
          "duration_seconds": 45
        },
        {
          "domain": "docs.google.com",
          "start_time": "2026-09-06T09:09:30Z",
          "end_time": "2026-09-06T09:10:00Z",
          "duration_seconds": 30
        }
      ]
    }
  ],
  "context_switches": {
    "app_switch_count": 1,
    "tab_switch_count": 2,
    "events": [
      { "type": "APP", "from": "VS Code", "to": "Chrome", "timestamp": "2026-09-06T09:06:30Z" },
      { "type": "TAB", "from": "github.com", "to": "stackoverflow.com", "timestamp": "2026-09-06T09:08:45Z" },
      { "type": "TAB", "from": "stackoverflow.com", "to": "docs.google.com", "timestamp": "2026-09-06T09:09:30Z" }
    ]
  },
  "input_activity": {
    "keystroke_count": 210,
    "mouse_event_count": 140,
    "active_seconds": 250,
    "idle_seconds": 50
  },
  "system_events": []
}
